{
  "format": "triangle-domain-mesh-only-config-v1",
  "schema_version": "1.0",
  "run_id": "replace-with-unique-mesh-diagnostic-id",
  "output_root": "work/domain_mesh_only_synthetic_a/output",
  "resources": {
    "max_workers": 1,
    "job_memory_limit_mib": 2048,
    "wall_clock_limit_s": 900.0,
    "output_budget_bytes": 1073741824,
    "scratch_budget_bytes": 16777216,
    "child_process_policy": "job_object_inheritance_without_breakaway"
  },
  "source_manifest": {
    "path": "work/domain_mesh_only_synthetic_a/inputs/source_manifest.json",
    "sha256": "0000000000000000000000000000000000000000000000000000000000000000",
    "expected_stat_identity": {"size_bytes": 0, "mtime_ns": 0, "ctime_ns": 0, "device": 0, "file_id": 0}
  },
  "target_coordinate_system": "EPSG:4548",
  "mesh_generation": {
    "maximum_faces": 500000,
    "maximum_nodes": 2000000,
    "minimum_face_quality": 0.1,
    "geometry_tolerance_m": 1e-8,
    "minimum_face_area_m2": 1e-12,
    "default_size_m": 50.0,
    "minimum_size_m": 1.0,
    "area_abs_tolerance_m2": 1e-7,
    "area_rel_tolerance": 1e-9
  },
  "expected_gmsh_version": "4.15.2",
  "expected_gmsh_library_sha256": "0000000000000000000000000000000000000000000000000000000000000000"
}
